{
  "$comment": "LLM-Nutzungsregeln — EINZIGE Quelle für Modellwahl. Normtexte verweisen nur hierher. Bei Marktwechsel diese Datei anpassen, nicht AGENTS.md.",
  "version": "1.4.0",
  "updated_at": "2026-08-26",
  "policy_id": "model-policy-v1.4",

  "entry_points": {
    "$comment": "Die Triage-Algebra (Klasse→Gates) ist deterministisch; die Erst-Klassifikation der Nutzeranfrage an N2 ist es nicht. Fixtures prüfen Ableitung, nicht LLM-Klassifikation (Annahme A-12). Deshalb darf der Main-Thread/Orchestrator nicht auf Composer starten.",
    "orchestrator_main_thread": {
      "roles": ["orchestrator", "sub_orchestrator"],
      "nodes": ["N0", "N1", "N2", "N7"],
      "default_model_id": "grok-4.6-high",
      "min_rank": 3,
      "allowed_ids": [
        "grok-4.6-high",
        "claude-opus-5-high",
        "claude-opus-5-xhigh"
      ],
      "forbidden_at_entry": ["composer-2.5", "gemini-3.7-flash-high", "grok-4.6-low"],
      "rule": "Main-Thread startet immer mit grok-4.6-high (oder höher nach Dead-End). Composer, Gemini Flash und Grok Low sind für Orchestrator-Triage/Clarify/Aggregation verboten.",
      "rationale": "Falsche Klasse/Flags an N2 → korrekte Algebra am falschen Ziel. Mitigation: starkes Modell am Eingang + LAW-CLARIFY; nicht Fixtures."
    }
  },

  "ladder": [
    {
      "rank": 1,
      "id": "composer-2.5",
      "label": "Composer 2.5",
      "when": "Standard für Coding-, Test- und klar definierte Sub-Agenten-Arbeit (nicht Orchestrator/N2)",
      "roles_preferred": [
        "developer",
        "tester_reviewer",
        "documentation_specialist",
        "devops_sre"
      ],
      "not_for": ["orchestrator", "sub_orchestrator", "N2"]
    },
    {
      "rank": 2,
      "id": "gemini-3.7-flash-high",
      "label": "Gemini 3.7 Flash High",
      "when": "Nur Sub-Agenten: wenn Composer steckenbleibt oder breite Exploration / schneller Durchsatz nötig ist",
      "requires": "documented_composer_stall_or_exploration_need",
      "not_for": ["orchestrator_main_thread_entry"]
    },
    {
      "rank": 3,
      "id": "grok-4.6-high",
      "label": "Grok 4.6 High",
      "when": "Default für Orchestrator-Main-Thread (N0–N2, N7). Für Sub-Agenten: schwere/lange Aufgaben nach Composer-Versuch oder von Anfang an außergewöhnlich komplex",
      "requires": "orchestrator_entry_or_composer_attempt_or_exceptional_complexity",
      "roles_preferred": [
        "orchestrator",
        "sub_orchestrator",
        "business_analyst",
        "architect",
        "researcher"
      ]
    },
    {
      "rank": 4,
      "id": "claude-opus-5-high",
      "label": "Claude Opus 5 High",
      "when": "Eskalation: Wenn Grok High falschen Ansatz verfolgt, feststeckt oder komplexere Kontext-Synthese nötig ist",
      "requires": "documented_grok_dead_end"
    },
    {
      "rank": 5,
      "id": "claude-opus-5-xhigh",
      "label": "Claude Opus 5 xHigh",
      "when": "Letzter Ausweg (höchstes Reasoning); Aufgabe eng eingrenzen",
      "requires": "last_resort_narrow_scope",
      "exceptions": [
        {
          "id": "architect_review",
          "when": "Architect-Triage / Architektur-Review laut live_matrix model_policy.architect_review",
          "model_id": "claude-opus-5-xhigh",
          "note": "Ausnahme zur Leiter für gezieltes Architektur-Review — nicht Ersatz für Rank 1 bei Coding-Sub-Agenten"
        }
      ]
    }
  ],

  "never": [
    { "id": "composer-fast", "reason": "zu flach / Qualitätsrisiko" },
    { "id": "grok-fast", "reason": "zu flach / Qualitätsrisiko" },
    { "id": "grok-4.6-extra-high", "reason": "Ineffizient (höherer Preis bei niedrigerem Benchmark-Index als Grok 4.6 High)" },
    {
      "id": "composer-as-orchestrator",
      "reason": "Composer nicht für Main-Thread/Triage (N2) — entry_points.orchestrator_main_thread"
    },
    {
      "id": "gemini-flash-as-orchestrator",
      "reason": "Gemini Flash nicht für Main-Thread/Triage (N2) — entry_points.orchestrator_main_thread"
    },
    {
      "id": "grok-low-as-orchestrator",
      "reason": "Grok Low zu schwach für Erst-Klassifikation an N2"
    },
    {
      "id": "grok-for-trivial-coding",
      "reason": "Grok nicht für triviale Coding-Sub-Tasks — Composer nutzen"
    },
    {
      "id": "sol-max",
      "reason": "Kosten/Latenz-Übermaß ($1.01 bei Index 61, 119s Gesamtzeit)"
    },
    {
      "id": "opus-max",
      "reason": "Kosten/Übermaß ($2.34 bei gleichem Index 63 wie xhigh)"
    },
    {
      "id": "claude-fable",
      "reason": "Extrem teuer ($3.14) und hohe Latenz (101s bei Index 62)"
    },
    {
      "id": "unlimited-cloud-jobs",
      "reason": "keine unbegrenzten Cloud-Aufträge"
    }
  ],

  "fallback_when_external_api_exhausted": {
    "description": "Wenn externe APIs ausgeschöpft oder blockiert sind: primär interne und Direct-Access-Stufen nutzen.",
    "orchestrator_allowed_ids": ["grok-4.6-high"],
    "subagent_allowed_ids": ["composer-2.5", "gemini-3.7-flash-high", "grok-4.6-high"],
    "rule": "Orchestrator bleibt auf grok-4.6-high. Sub-Agenten nutzen Leiter 1→2→3. Ränge 4 und 5 entfallen bis externe Provider wieder ansprechbar sind."
  },

  "user_override": {
    "allowed": true,
    "requires": "Auftraggeber nennt das Modell namentlich; Eintrag in model_usage[] und Handover",
    "on_platform_block": "fehlende Voraussetzung (z. B. Fable Data-Retention-Ack) benennen und Fallback sagen; nie still ersetzen",
    "fable_retention_ack_url": "https://cursor.com/dashboard/restricted_models/claude-fable-5"
  },

  "enforcement": {
    "source_of_truth": "config/model-policy.json",
    "orchestrator_must": "Gewähltes Modell je Sub-Agent und für den Main-Thread in State unter model_usage[] protokollieren (id, rank, reason, entry_point).",
    "upgrade_requires": "Kurze Begründung im Handover (warum Rank n nicht reichte).",
    "downgrade_preferred": true,
    "downgrade_exception": "Kein Downgrade des Main-Threads unter grok-4.6-high.",
    "hard_block_never_list": true,
    "hard_block_exception": "user_override"
  }
}
